product_name,product_version,oem_name,severity_level,vulnerability_description,mitigation_strategy,published_date,cve_id,url
Chromium GPU,Multiple,Google,Critical,"Google Chromium GPU contains a heap buffer overflow vulnerability that allows a remote attacker, who has compromised the renderer process, to potentially perform a sandbox escape via a crafted HTML page. This vulnerability could affect multiple web browsers that utilize Chromium, including, but not limited to, Google Chrome, Microsoft Edge, and Opera.",Apply updates per vendor instructions.,2022-11-28,CVE-2022-4135,https://nvd.nist.gov/vuln/detail/CVE-2022-4135
Windows,Multiple,Microsoft,Critical,Microsoft Windows Mark of the Web (MOTW) contains a security feature bypass vulnerability resulting in a limited loss of integrity and availability of security features.,Apply updates per vendor instructions.,2022-11-14,CVE-2022-41049,https://nvd.nist.gov/vuln/detail/CVE-2022-41049
Windows,Multiple,Microsoft,Critical,Microsoft Windows Mark of the Web (MOTW) contains a security feature bypass vulnerability resulting in a limited loss of integrity and availability of security features.,Apply updates per vendor instructions.,2022-11-08,CVE-2022-41091,https://nvd.nist.gov/vuln/detail/CVE-2022-41091
Windows,Multiple,Microsoft,Critical,Microsoft Windows Print Spooler contains an unspecified vulnerability that allows an attacker to gain SYSTEM-level privileges.,Apply updates per vendor instructions.,2022-11-08,CVE-2022-41073,https://nvd.nist.gov/vuln/detail/CVE-2022-41073
Windows,Multiple,Microsoft,Critical,Microsoft Windows Cryptographic Next Generation (CNG) Key Isolation Service contains an unspecified vulnerability that allows an attacker to gain SYSTEM-level privileges.,Apply updates per vendor instructions.,2022-11-08,CVE-2022-41125,https://nvd.nist.gov/vuln/detail/CVE-2022-41125
Windows,Multiple,Microsoft,Critical,Microsoft Windows contains an unspecified vulnerability in the JScript9 scripting language which allows for remote code execution.,Apply updates per vendor instructions.,2022-11-08,CVE-2022-41128,https://nvd.nist.gov/vuln/detail/CVE-2022-41128
Mobile Devices,Multiple,Samsung,Critical,Samsung mobile devices contain an improper access control vulnerability in clipboard service which allows untrusted applications to read or write arbitrary files. This vulnerability was chained with CVE-2021-25369 and CVE-2021-25370.,Apply updates per vendor instructions.,2022-11-08,CVE-2021-25337,https://nvd.nist.gov/vuln/detail/CVE-2021-25337
Mobile Devices,Multiple,Samsung,Critical,Samsung mobile devices using Mali GPU contains an improper access control vulnerability in sec_log file. Exploitation of the vulnerability exposes sensitive kernel information to the userspace. This vulnerability was chained with CVE-2021-25337 and CVE-2021-25370.,Apply updates per vendor instructions.,2022-11-08,CVE-2021-25369,https://nvd.nist.gov/vuln/detail/CVE-2021-25369
Mobile Devices,Multiple,Samsung,Critical,"Samsung mobile devices using Mali GPU contain an incorrect implementation handling file descriptor in dpu driver. This incorrect implementation results in memory corruption, leading to kernel panic. This vulnerability was chained with CVE-2021-25337 and CVE-2021-25369.",Apply updates per vendor instructions.,2022-11-08,CVE-2021-25370,https://nvd.nist.gov/vuln/detail/CVE-2021-25370
Chromium V8,Multiple,Google,Critical,"Google Chromium V8 Engine contains a type confusion vulnerability that allows a remote attacker to potentially exploit heap corruption via a crafted HTML page. This vulnerability could affect multiple web browsers that utilize Chromium, including, but not limited to, Google Chrome, Microsoft Edge, and Opera.",Apply updates per vendor instructions.,2022-10-28,CVE-2022-3723,https://nvd.nist.gov/vuln/detail/CVE-2022-3723
iOS and iPadOS,Multiple,Apple,Critical,Apple iOS and iPadOS kernel contain an out-of-bounds write vulnerability which can allow an application to perform code execution with kernel privileges.,Apply updates per vendor instructions.,2022-10-25,CVE-2022-42827,https://nvd.nist.gov/vuln/detail/CVE-2022-42827
AnyConnect Secure,Multiple,Cisco,Critical,Cisco AnyConnect Secure Mobility Client for Windows interprocess communication (IPC) channel allows for insufficient validation of resources that are loaded by the application at run time. An attacker with valid credentials on Windows could execute code on the affected machine with SYSTEM privileges.,Apply updates per vendor instructions.,2022-10-24,CVE-2020-3433,https://nvd.nist.gov/vuln/detail/CVE-2020-3433
AnyConnect Secure,Multiple,Cisco,Critical,"Cisco AnyConnect Secure Mobility Client for Windows allows for incorrect handling of directory paths. An attacker with valid credentials on Windows would be able to copy malicious files to arbitrary locations with system level privileges. This could include DLL pre-loading, DLL hijacking, and other related attacks.",Apply updates per vendor instructions.,2022-10-24,CVE-2020-3153,https://nvd.nist.gov/vuln/detail/CVE-2020-3153
Multiple Products,Multiple,GIGABYTE,Critical,"The GPCIDrv and GDrv low-level drivers in GIGABYTE App Center, AORUS Graphics Engine, XTREME Gaming Engine, and OC GURU expose functionality to read and write arbitrary physical memory. This could be leveraged by a local attacker to elevate privileges.",Apply updates per vendor instructions.,2022-10-24,CVE-2018-19323,https://nvd.nist.gov/vuln/detail/CVE-2018-19323
Multiple Products,Multiple,GIGABYTE,Critical,"The GPCIDrv and GDrv low-level drivers in GIGABYTE App Center, AORUS Graphics Engine, XTREME Gaming Engine, and OC GURU II expose functionality to read/write data from/to IO ports. This could be leveraged in a number of ways to ultimately run code with elevated privileges.",Apply updates per vendor instructions.,2022-10-24,CVE-2018-19322,https://nvd.nist.gov/vuln/detail/CVE-2018-19322
Multiple Products,Multiple,GIGABYTE,Critical,"The GPCIDrv and GDrv low-level drivers in GIGABYTE App Center, AORUS Graphics Engine, XTREME Gaming Engine, and OC GURU II expose functionality to read and write arbitrary physical memory. This could be leveraged by a local attacker to elevate privileges.",Apply updates per vendor instructions.,2022-10-24,CVE-2018-19321,https://nvd.nist.gov/vuln/detail/CVE-2018-19321
Multiple Products,Multiple,GIGABYTE,Critical,"The GDrv low-level driver in GIGABYTE App Center, AORUS Graphics Engine, XTREME Gaming Engine, and OC GURU II exposes ring0 memcpy-like functionality that could allow a local attacker to take complete control of the affected system.",Apply updates per vendor instructions.,2022-10-24,CVE-2018-19320,https://nvd.nist.gov/vuln/detail/CVE-2018-19320
Zimbra Collaboration Suite (ZCS),Multiple,Synacor,Critical,Synacor Zimbra Collaboration Suite (ZCS) allows an attacker to upload arbitrary files using cpio package to gain incorrect access to any other user accounts.,Apply updates per vendor instructions.,2022-10-20,CVE-2022-41352,https://nvd.nist.gov/vuln/detail/CVE-2022-41352
Kernel,Multiple,Linux,Critical,"The overlayfs stacking file system in Linux kernel does not properly validate the application of file capabilities against user namespaces, which could lead to privilege escalation.",Apply updates per vendor instructions.,2022-10-20,CVE-2021-3493,https://nvd.nist.gov/vuln/detail/CVE-2021-3493
Multiple Products,Multiple,Fortinet,Critical,"Fortinet FortiOS, FortiProxy, and FortiSwitchManager contain an authentication bypass vulnerability that could allow an unauthenticated attacker to perform operations on the administrative interface via specially crafted HTTP or HTTPS requests.",Apply updates per vendor instructions.,2022-10-11,CVE-2022-40684,https://nvd.nist.gov/vuln/detail/CVE-2022-40684
Windows COM+ Event System Service,Multiple,Microsoft,Critical,Microsoft Windows COM+ Event System Service contains an unspecified vulnerability that allows for privilege escalation.,Apply updates per vendor instructions.,2022-10-11,CVE-2022-41033,https://nvd.nist.gov/vuln/detail/CVE-2022-41033
Exchange Server,Multiple,Microsoft,Critical,"Microsoft Exchange Server contains an unspecified vulnerability that allows for authenticated remote code execution. Dubbed ""ProxyNotShell,"" this vulnerability is chainable with CVE-2022-41040 which allows for the remote code execution.",Apply updates per vendor instructions.,2022-09-30,CVE-2022-41082,https://nvd.nist.gov/vuln/detail/CVE-2022-41082
Exchange Server,Multiple,Microsoft,Critical,"Microsoft Exchange Server allows for server-side request forgery. Dubbed ""ProxyNotShell,"" this vulnerability is chainable with CVE-2022-41082 which allows for remote code execution.",Apply updates per vendor instructions.,2022-09-30,CVE-2022-41040,https://nvd.nist.gov/vuln/detail/CVE-2022-41040
Bitbucket Server and Data Center,Multiple,Atlassian,Critical,"Multiple API endpoints of Atlassian Bitbucket Server and Data Center contain a command injection vulnerability where an attacker with access to a public Bitbucket repository, or with read permissions to a private one, can execute code by sending a malicious HTTP request.",Apply updates per vendor instructions.,2022-09-30,CVE-2022-36804,https://nvd.nist.gov/vuln/detail/CVE-2022-36804
Firewall,Multiple,Sophos,Critical,A code injection vulnerability in the User Portal and Webadmin of Sophos Firewall allows for remote code execution.,Apply updates per vendor instructions.,2022-09-23,CVE-2022-3236,https://nvd.nist.gov/vuln/detail/CVE-2022-3236
ManageEngine,Multiple,Zoho,Critical,"Zoho ManageEngine PAM360, Password Manager Pro, and Access Manager Plus contain an unspecified vulnerability that allows for remote code execution.",Apply updates per vendor instructions.,2022-09-22,CVE-2022-35405,https://nvd.nist.gov/vuln/detail/CVE-2022-35405
Apex One and Apex One as a Service,Multiple,Trend Micro,Critical,Trend Micro Apex One and Apex One as a Service contain an improper validation of rollback mechanism components that could lead to remote code execution.,Apply updates per vendor instructions.,2022-09-15,CVE-2022-40139,https://nvd.nist.gov/vuln/detail/CVE-2022-40139
Kernel,Multiple,Linux,Critical,The get_user and put_user API functions of the Linux kernel fail to validate the target address when being used on ARM v6k/v7 platforms. This allows an application to read and write kernel memory which could lead to privilege escalation.,Apply updates per vendor instructions.,2022-09-15,CVE-2013-6282,https://nvd.nist.gov/vuln/detail/CVE-2013-6282
ACDB Audio Driver,Multiple,Code Aurora,Critical,The Code Aurora audio calibration database (acdb) audio driver contains a stack-based buffer overflow vulnerability that allows for privilege escalation. Code Aurora is used in third-party products such as Qualcomm and Android.,Apply updates per vendor instructions.,2022-09-15,CVE-2013-2597,https://nvd.nist.gov/vuln/detail/CVE-2013-2597
Kernel,Multiple,Linux,Critical,Linux kernel fb_mmap function in drivers/video/fbmem.c contains an integer overflow vulnerability that allows for privilege escalation.,Apply updates per vendor instructions.,2022-09-15,CVE-2013-2596,https://nvd.nist.gov/vuln/detail/CVE-2013-2596
Kernel,Multiple,Linux,Critical,"Linux kernel fails to check all 64 bits of attr.config passed by user space, resulting to out-of-bounds access of the perf_swevent_enabled array in sw_perf_event_destroy(). Explotation allows for privilege escalation.",Apply updates per vendor instructions.,2022-09-15,CVE-2013-2094,https://nvd.nist.gov/vuln/detail/CVE-2013-2094
Windows,Multiple,Microsoft,Critical,Microsoft Windows incorrectly parses shortcuts in such a way that malicious code may be executed when the operating system displays the icon of a malicious shortcut file. An attacker who successfully exploited this vulnerability could execute code as the logged-on user.,Apply updates per vendor instructions.,2022-09-15,CVE-2010-2568,https://nvd.nist.gov/vuln/detail/CVE-2010-2568
Windows,Multiple,Microsoft,Critical,Microsoft Windows Common Log File System (CLFS) driver contains an unspecified vulnerability that allows for privilege escalation.,Apply updates per vendor instructions.,2022-09-14,CVE-2022-37969,https://nvd.nist.gov/vuln/detail/CVE-2022-37969
"iOS, iPadOS, and macOS",Multiple,Apple,Critical,"Apple kernel, which is included in iOS, iPadOS, and macOS, contains an unspecified vulnerability where an application may be able to execute code with kernel privileges.",Apply updates per vendor instructions.,2022-09-14,CVE-2022-32917,https://nvd.nist.gov/vuln/detail/CVE-2022-32917
Chromium Mojo,Multiple,Google,Critical,"Google Chromium Mojo contains an insufficient data validation vulnerability that allows a remote attacker, who has compromised the renderer process, to potentially perform a sandbox escape via a crafted HTML page. This vulnerability could affect multiple web browsers that utilize Chromium, including, but not limited to, Google Chrome, Microsoft Edge, and Opera.",Apply updates per vendor instructions.,2022-09-08,CVE-2022-3075,https://nvd.nist.gov/vuln/detail/CVE-2022-3075
Photo Station,Multiple,QNAP,Critical,Certain QNAP NAS running Photo Station with internet exposure contain an externally controlled reference to a resource vulnerability which can allow an attacker to modify system files. This vulnerability was observed being utilized in a Deadbolt ransomware campaign.,Apply updates per vendor instructions.,2022-09-08,CVE-2022-27593,https://nvd.nist.gov/vuln/detail/CVE-2022-27593
DIR-820L,Multiple,D-Link,Critical,D-Link DIR-820L contains an unspecified vulnerability in Device Name parameter in /lan.asp which allows for remote code execution.,The impacted product is end-of-life and should be disconnected if still in use.,2022-09-08,CVE-2022-26258,https://nvd.nist.gov/vuln/detail/CVE-2022-26258
"iOS, iPadOS, and macOS",Multiple,Apple,Critical,"Apple iOS, iPadOS, and macOS contain an unspecified vulnerability involving input validation which can allow a local attacker to view sensitive user information.",Apply updates per vendor instructions.,2022-09-08,CVE-2020-9934,https://nvd.nist.gov/vuln/detail/CVE-2020-9934
RouterOS,Multiple,MikroTik,Critical,"In MikroTik RouterOS, a stack-based buffer overflow occurs when processing NetBIOS session request messages. Remote attackers with access to the service can exploit this vulnerability and gain code execution on the system.",Apply updates per vendor instructions.,2022-09-08,CVE-2018-7445,https://nvd.nist.gov/vuln/detail/CVE-2018-7445
Multiple Routers,Multiple,D-Link,Critical,Multiple D-Link routers contain an unspecified vulnerability that allows for execution of OS commands.,"The vendor D-Link published an advisory stating the fix under CVE-2018-20114 properly patches KEV entry CVE-2018-6530. If the device is still supported, apply updates per vendor instructions. If the affected device has since entered its end-of-life, it should be disconnected if still in use.",2022-09-08,CVE-2018-6530,https://nvd.nist.gov/vuln/detail/CVE-2018-6530
WebLogic Server,Multiple,Oracle,Critical,Oracle WebLogic Server contains an unspecified vulnerability which can allow an unauthenticated attacker with T3 network access to compromise the server.,Apply updates per vendor instructions.,2022-09-08,CVE-2018-2628,https://nvd.nist.gov/vuln/detail/CVE-2018-2628
FortiOS and FortiADC,Multiple,Fortinet,Critical,Fortinet FortiOS and FortiADC contain an improper access control vulnerability that allows attackers to obtain the LDAP server login credentials configured in FortiGate by pointing a LDAP server connectivity test request to a rogue LDAP server.,Apply updates per vendor instructions.,2022-09-08,CVE-2018-13374,https://nvd.nist.gov/vuln/detail/CVE-2018-13374
Multiple Devices,Multiple,NETGEAR,Critical,Multiple NETGEAR devices are prone to admin password disclosure via simple crafted requests to the web management server.,"Apply updates per vendor instructions. If the affected device has since entered end-of-life, it should be disconnected if still in use.",2022-09-08,CVE-2017-5521,https://nvd.nist.gov/vuln/detail/CVE-2017-5521
DIR-300 Router,Multiple,D-Link,Critical,"The D-Link DIR-300 router stores cleartext passwords, which allows context-dependent attackers to obtain sensitive information.",The impacted product is end-of-life and should be disconnected if still in use.,2022-09-08,CVE-2011-4723,https://nvd.nist.gov/vuln/detail/CVE-2011-4723
Android OS,Multiple,Android,Critical,"The vold volume manager daemon in Android kernel trusts messages from a PF_NETLINK socket, which allows an attacker to execute code and gain root privileges. This vulnerability is associated with GingerBreak and Exploit.AndroidOS.Lotoor.",Apply updates per vendor instructions.,2022-09-08,CVE-2011-1823,https://nvd.nist.gov/vuln/detail/CVE-2011-1823
dotCMS,Multiple,dotCMS,Critical,"dotCMS ContentResource API contains an unrestricted upload of file with a dangerous type vulnerability that allows for directory traversal, in which the file is saved outside of the intended storage location. Exploitation allows for remote code execution.",Apply updates per vendor instructions.,2022-08-25,CVE-2022-26352,https://nvd.nist.gov/vuln/detail/CVE-2022-26352
CouchDB,Multiple,Apache,Critical,Apache CouchDB contains an insecure default initialization of resource vulnerability which can allow an attacker to escalate to administrative privileges.,Apply updates per vendor instructions.,2022-08-25,CVE-2022-24706,https://nvd.nist.gov/vuln/detail/CVE-2022-24706
APISIX,Multiple,Apache,Critical,Apache APISIX contains an authentication bypass vulnerability that allows for remote code execution.,Apply updates per vendor instructions.,2022-08-25,CVE-2022-24112,https://nvd.nist.gov/vuln/detail/CVE-2022-24112
Spring Cloud,Multiple,VMware Tanzu,Critical,"When using routing functionality in VMware Tanzu's Spring Cloud Function, it is possible for a user to provide a specially crafted SpEL as a routing-expression that may result in remote code execution and access to local resources.",Apply updates per vendor instructions.,2022-08-25,CVE-2022-22963,https://nvd.nist.gov/vuln/detail/CVE-2022-22963
WebRTC,Multiple,WebRTC,Critical,"WebRTC, an open-source project providing web browsers with real-time communication, contains a heap buffer overflow vulnerability that allows an attacker to perform shellcode execution. This vulnerability impacts web browsers using WebRTC including but not limited to Google Chrome.",Apply updates per vendor instructions.,2022-08-25,CVE-2022-2294,https://nvd.nist.gov/vuln/detail/CVE-2022-2294
Grafana,Multiple,Grafana Labs,Critical,"Grafana contains an authentication bypass vulnerability that allows authenticated and unauthenticated users to view and delete all snapshot data, potentially resulting in complete snapshot data loss.",Apply updates per vendor instructions.,2022-08-25,CVE-2021-39226,https://nvd.nist.gov/vuln/detail/CVE-2021-39226
DOPSoft 2,Multiple,Delta Electronics,Critical,Delta Electronics DOPSoft 2 lacks proper validation of user-supplied data when parsing specific project files (improper input validation) resulting in an out-of-bounds write that allows for code execution.,The impacted product is end-of-life and should be disconnected if still in use.,2022-08-25,CVE-2021-38406,https://nvd.nist.gov/vuln/detail/CVE-2021-38406
"iOS, macOS, watchOS",Multiple,Apple,Critical,"In affected versions of Apple iOS, macOS, and watchOS, a sandboxed process may be able to circumvent sandbox restrictions.",Apply updates per vendor instructions.,2022-08-25,CVE-2021-31010,https://nvd.nist.gov/vuln/detail/CVE-2021-31010
Archive_Tar,Multiple,PEAR,Critical,PEAR Archive_Tar Tar.php allows write operations with directory traversal due to inadequate checking of symbolic links. PEAR stands for PHP Extension and Application Repository and it is an open-source framework and distribution system for reusable PHP components with known usage in third-party products such as Drupal Core and Red Hat Linux.,Apply updates per vendor instructions.,2022-08-25,CVE-2020-36193,https://nvd.nist.gov/vuln/detail/CVE-2020-36193
Archive_Tar,Multiple,PEAR,Critical,PEAR Archive_Tar allows an unserialization attack because phar: is blocked but PHAR: is not blocked. PEAR stands for PHP Extension and Application Repository and it is an open-source framework and distribution system for reusable PHP components with known usage in third-party products such as Drupal Core and Red Hat Linux.,Apply updates per vendor instructions.,2022-08-25,CVE-2020-28949,https://nvd.nist.gov/vuln/detail/CVE-2020-28949
PAN-OS,Multiple,Palo Alto Networks,Critical,A Palo Alto Networks PAN-OS URL filtering policy misconfiguration could allow a network-based attacker to conduct reflected and amplified TCP denial-of-service (RDoS) attacks.,Apply updates per vendor instructions.,2022-08-22,CVE-2022-0028,https://nvd.nist.gov/vuln/detail/CVE-2022-0028
Multiple Products,Multiple,SAP,Critical,"SAP NetWeaver Application Server ABAP, SAP NetWeaver Application Server Java, ABAP Platform, SAP Content Server and SAP Web Dispatcher allow HTTP request smuggling. An unauthenticated attacker can prepend a victim's request with arbitrary data, allowing for function execution impersonating the victim or poisoning intermediary Web caches.",Apply updates per vendor instructions.,2022-08-18,CVE-2022-22536,https://nvd.nist.gov/vuln/detail/CVE-2022-22536
iOS and macOS,Multiple,Apple,Critical,Apple iOS and macOS contain an out-of-bounds write vulnerability that could allow an application to execute code with kernel privileges.,Apply updates per vendor instructions.,2022-08-18,CVE-2022-32894,https://nvd.nist.gov/vuln/detail/CVE-2022-32894
iOS and macOS,Multiple,Apple,Critical,Apple iOS and macOS contain an out-of-bounds write vulnerability that could allow for remote code execution when processing malicious crafted web content.,Apply updates per vendor instructions.,2022-08-18,CVE-2022-32893,https://nvd.nist.gov/vuln/detail/CVE-2022-32893
Chromium Intents,Multiple,Google,Critical,"Google Chromium Intents contains an insufficient validation of untrusted input vulnerability that allows a remote attacker to browse to a malicious website via a crafted HTML page. This vulnerability could affect multiple web browsers that utilize Chromium, including, but not limited to, Google Chrome, Microsoft Edge, and Opera.",Apply updates per vendor instructions.,2022-08-18,CVE-2022-2856,https://nvd.nist.gov/vuln/detail/CVE-2022-2856
Active Directory,Multiple,Microsoft,Critical,"An authenticated user could manipulate attributes on computer accounts they own or manage, and acquire a certificate from Active Directory Certificate Services that would allow for privilege escalation to SYSTEM.",Apply updates per vendor instructions.,2022-08-18,CVE-2022-26923,https://nvd.nist.gov/vuln/detail/CVE-2022-26923
Windows,Multiple,Microsoft,Critical,Microsoft Windows Runtime contains an unspecified vulnerability that allows for remote code execution.,Apply updates per vendor instructions.,2022-08-18,CVE-2022-21971,https://nvd.nist.gov/vuln/detail/CVE-2022-21971
PAN-OS,Multiple,Palo Alto Networks,Critical,"Palo Alto Networks PAN-OS contains multiple, unspecified vulnerabilities which can allow for remote code execution when chained.",Apply updates per vendor instructions.,2022-08-18,CVE-2017-15944,https://nvd.nist.gov/vuln/detail/CVE-2017-15944
Zimbra Collaboration Suite (ZCS),Multiple,Synacor,Critical,"Synacor Zimbra Collaboration Suite (ZCS) contains flaw in the mboximport functionality, allowing an authenticated attacker to upload arbitrary files to perform remote code execution. This vulnerability was chained with CVE-2022-37042 which allows for unauthenticated remote code execution.",Apply updates per vendor instructions.,2022-08-11,CVE-2022-27925,https://nvd.nist.gov/vuln/detail/CVE-2022-27925
Zimbra Collaboration Suite (ZCS),Multiple,Synacor,Critical,Synacor Zimbra Collaboration Suite (ZCS) contains an authentication bypass vulnerability in MailboxImportServlet. This vulnerability was chained with CVE-2022-27925 which allows for unauthenticated remote code execution.,Apply updates per vendor instructions.,2022-08-11,CVE-2022-37042,https://nvd.nist.gov/vuln/detail/CVE-2022-37042
Windows,Multiple,Microsoft,Critical,A remote code execution vulnerability exists when Microsoft Windows MSDT is called using the URL protocol from a calling application.,Apply updates per vendor instructions.,2022-08-09,CVE-2022-34713,https://nvd.nist.gov/vuln/detail/CVE-2022-34713
UnRAR,Multiple,RARLAB,Critical,"RARLAB UnRAR on Linux and UNIX contains a directory traversal vulnerability, allowing an attacker to write to files during an extract (unpack) operation.",Apply updates per vendor instructions.,2022-08-09,CVE-2022-30333,https://nvd.nist.gov/vuln/detail/CVE-2022-30333
Zimbra Collaboration Suite (ZCS),Multiple,Synacor,Critical,Synacor Zimbra Collaboration Suite (ZCS) allows an attacker to inject memcache commands into a targeted instance which causes an overwrite of arbitrary cached entries.,Apply updates per vendor instructions.,2022-08-04,CVE-2022-27924,https://nvd.nist.gov/vuln/detail/CVE-2022-27924
Confluence,Multiple,Atlassian,Critical,"Atlassian Questions For Confluence App has hard-coded credentials, exposing the username and password in plaintext. A remote unauthenticated attacker can use these credentials to log into Confluence and access all content accessible to users in the confluence-users group.",Apply updates per vendor instructions.,2022-07-29,CVE-2022-26138,https://nvd.nist.gov/vuln/detail/CVE-2022-26138
Windows,Multiple,Microsoft,Critical,Microsoft Windows CSRSS contains an unspecified vulnerability that allows for privilege escalation to SYSTEM privileges.,Apply updates per vendor instructions.,2022-07-12,CVE-2022-22047,https://nvd.nist.gov/vuln/detail/CVE-2022-22047
