product_name,product_version,oem_name,severity_level,vulnerability_description,mitigation_strategy,published_date,cve_id,url
Chromium V8,Multiple,Google,Critical,"Google Chromium V8 contains an inappropriate implementation vulnerability that allows a remote attacker to potentially exploit heap corruption via a crafted HTML page. This vulnerability could affect multiple web browsers that utilize Chromium, including, but not limited to, Google Chrome, Microsoft Edge, and Opera.",Apply mitigations per vendor instructions or discontinue use of the product if mitigations are unavailable.,2024-08-28,CVE-2024-7965,https://nvd.nist.gov/vuln/detail/CVE-2024-7965
OFBiz,Multiple,Apache,Critical,Apache OFBiz contains an incorrect authorization vulnerability that could allow remote code execution via a Groovy payload in the context of the OFBiz user process by an unauthenticated attacker.,Apply mitigations per vendor instructions or discontinue use of the product if mitigations are unavailable.,2024-08-27,CVE-2024-38856,https://nvd.nist.gov/vuln/detail/CVE-2024-38856
Chromium V8,Multiple,Google,Critical,"Google Chromium V8 contains a type confusion vulnerability that allows a remote attacker to exploit heap corruption via a crafted HTML page. This vulnerability could affect multiple web browsers that utilize Chromium, including, but not limited to, Google Chrome, Microsoft Edge, and Opera.",Apply mitigations per vendor instructions or discontinue use of the product if mitigations are unavailable.,2024-08-26,CVE-2024-7971,https://nvd.nist.gov/vuln/detail/CVE-2024-7971
Director,Multiple,Versa,Critical,"The Versa Director GUI contains an unrestricted upload of file with dangerous type vulnerability that allows administrators with Provider-Data-Center-Admin or Provider-Data-Center-System-Admin privileges to customize the user interface. The “Change Favicon” (Favorite Icon) enables the upload of a .png file, which can be exploited to upload a malicious file with a .png extension disguised as an image.",Apply mitigations per vendor instructions or discontinue use of the product if mitigations are unavailable.,2024-08-23,CVE-2024-39717,https://nvd.nist.gov/vuln/detail/CVE-2024-39717
Exchange Server,Multiple,Microsoft,Critical,Microsoft Exchange Server contains an information disclosure vulnerability that allows for remote code execution.,Apply mitigations per vendor instructions or discontinue use of the product if mitigations are unavailable.,2024-08-21,CVE-2021-31196,https://nvd.nist.gov/vuln/detail/CVE-2021-31196
Kernel,Multiple,Linux,Critical,Linux kernel contains a heap-based buffer overflow vulnerability in the legacy_parse_param function in the Filesystem Context functionality. This allows an attacker to open a filesystem that does not support the Filesystem Context API and ultimately escalate privileges.,Apply updates per vendor instructions or discontinue use of the product if updates are unavailable.,2024-08-21,CVE-2022-0185,https://nvd.nist.gov/vuln/detail/CVE-2022-0185
IP Camera Firmware,Multiple,Dahua,Critical,Dahua IP cameras and related products contain an authentication bypass vulnerability when the loopback device is specified by the client during authentication.,Apply mitigations per vendor instructions or discontinue use of the product if mitigations are unavailable.,2024-08-21,CVE-2021-33045,https://nvd.nist.gov/vuln/detail/CVE-2021-33045
IP Camera Firmware,Multiple,Dahua,Critical,Dahua IP cameras and related products contain an authentication bypass vulnerability when the NetKeyboard type argument is specified by the client during authentication.,Apply mitigations per vendor instructions or discontinue use of the product if mitigations are unavailable.,2024-08-21,CVE-2021-33044,https://nvd.nist.gov/vuln/detail/CVE-2021-33044
Jenkins Command Line Interface (CLI),Multiple,Jenkins,Critical,"Jenkins Command Line Interface (CLI) contains a path traversal vulnerability that allows attackers limited read access to certain files, which can lead to code execution.",Apply mitigations per vendor instructions or discontinue use of the product if mitigations are unavailable.,2024-08-19,CVE-2024-23897,https://nvd.nist.gov/vuln/detail/CVE-2024-23897
Web Help Desk,Multiple,SolarWinds,Critical,SolarWinds Web Help Desk contains a deserialization of untrusted data vulnerability that could allow for remote code execution.,Apply mitigations per vendor instructions or discontinue use of the product if mitigations are unavailable.,2024-08-15,CVE-2024-28986,https://nvd.nist.gov/vuln/detail/CVE-2024-28986
Windows,Multiple,Microsoft,Critical,"Microsoft Windows Power Dependency Coordinator contains an unspecified vulnerability that allows for privilege escalation, enabling a local attacker to obtain SYSTEM privileges.",Apply mitigations per vendor instructions or discontinue use of the product if mitigations are unavailable.,2024-08-13,CVE-2024-38107,https://nvd.nist.gov/vuln/detail/CVE-2024-38107
Windows,Multiple,Microsoft,Critical,"Microsoft Windows Kernel contains an unspecified vulnerability that allows for privilege escalation, enabling a local attacker to gain SYSTEM privileges. Successful exploitation of this vulnerability requires an attacker to win a race condition.",Apply mitigations per vendor instructions or discontinue use of the product if mitigations are unavailable.,2024-08-13,CVE-2024-38106,https://nvd.nist.gov/vuln/detail/CVE-2024-38106
Windows,Multiple,Microsoft,Critical,"Microsoft Windows Ancillary Function Driver for WinSock contains an unspecified vulnerability that allows for privilege escalation, enabling a local attacker to gain SYSTEM privileges.",Apply mitigations per vendor instructions or discontinue use of the product if mitigations are unavailable.,2024-08-13,CVE-2024-38193,https://nvd.nist.gov/vuln/detail/CVE-2024-38193
Windows,Multiple,Microsoft,Critical,Microsoft Windows SmartScreen contains a security feature bypass vulnerability that allows an attacker to bypass the SmartScreen user experience via a malicious file.,Apply mitigations per vendor instructions or discontinue use of the product if mitigations are unavailable.,2024-08-13,CVE-2024-38213,https://nvd.nist.gov/vuln/detail/CVE-2024-38213
Windows,Multiple,Microsoft,Critical,Microsoft Windows Scripting Engine contains a memory corruption vulnerability that allows unauthenticated attacker to initiate remote code execution via a specially crafted URL.,Apply mitigations per vendor instructions or discontinue use of the product if mitigations are unavailable.,2024-08-13,CVE-2024-38178,https://nvd.nist.gov/vuln/detail/CVE-2024-38178
Project,Multiple,Microsoft,Critical,Microsoft Project contains an unspecified vulnerability that allows for remote code execution via a malicious file.,Apply mitigations per vendor instructions or discontinue use of the product if mitigations are unavailable.,2024-08-13,CVE-2024-38189,https://nvd.nist.gov/vuln/detail/CVE-2024-38189
OFBiz,Multiple,Apache,Critical,Apache OFBiz contains a path traversal vulnerability that could allow for remote code execution.,Apply mitigations per vendor instructions or discontinue use of the product if mitigations are unavailable.,2024-08-07,CVE-2024-32113,https://nvd.nist.gov/vuln/detail/CVE-2024-32113
Kernel,Multiple,Android,Critical,"Android contains an unspecified vulnerability in the kernel that allows for remote code execution. This vulnerability resides in Linux Kernel and could impact other products, including but not limited to Android OS.",Apply mitigations per vendor instructions or discontinue use of the product if mitigations are unavailable.,2024-08-07,CVE-2024-36971,https://nvd.nist.gov/vuln/detail/CVE-2024-36971
Windows,Multiple,Microsoft,Critical,Microsoft COM for Windows contains a deserialization of untrusted data vulnerability that allows for privilege escalation and remote code execution via a specially crafted file or script.,Apply mitigations per vendor instructions or discontinue use of the product if mitigations are unavailable.,2024-08-05,CVE-2018-0824,https://nvd.nist.gov/vuln/detail/CVE-2018-0824
ESXi,Multiple,VMware,Critical,VMware ESXi contains an authentication bypass vulnerability. A malicious actor with sufficient Active Directory (AD) permissions can gain full access to an ESXi host that was previously configured to use AD for user management by re-creating the configured AD group ('ESXi Admins' by default) after it was deleted from AD.,Apply mitigations per vendor instructions or discontinue use of the product if mitigations are unavailable.,2024-07-30,CVE-2024-37085,https://nvd.nist.gov/vuln/detail/CVE-2024-37085
Cyber Infrastructure (ACI),Multiple,Acronis,Critical,Acronis Cyber Infrastructure (ACI) allows an unauthenticated user to execute commands remotely due to the use of default passwords.,Apply mitigations per vendor instructions or discontinue use of the product if mitigations are unavailable.,2024-07-29,CVE-2023-45249,https://nvd.nist.gov/vuln/detail/CVE-2023-45249
"Utah, Vancouver, and Washington DC Now Platform",Multiple,ServiceNow,Critical,"ServiceNow Washington DC, Vancouver, and earlier Now Platform releases contain an incomplete list of disallowed inputs vulnerability in the GlideExpression script. An unauthenticated user could exploit this vulnerability to execute code remotely.",Apply mitigations per vendor instructions or discontinue use of the product if mitigations are unavailable.,2024-07-29,CVE-2024-5217,https://nvd.nist.gov/vuln/detail/CVE-2024-5217
"Utah, Vancouver, and Washington DC Now Platform",Multiple,ServiceNow,Critical,"ServiceNow Utah, Vancouver, and Washington DC Now Platform releases contain a jelly template injection vulnerability in UI macros. An unauthenticated user could exploit this vulnerability to execute code remotely. ",Apply mitigations per vendor instructions or discontinue use of the product if mitigations are unavailable.,2024-07-29,CVE-2024-4879,https://nvd.nist.gov/vuln/detail/CVE-2024-4879
Authy,Multiple,Twilio,Critical,Twilio Authy contains an information disclosure vulnerability in its API that allows an unauthenticated endpoint to accept a request containing a phone number and respond with information about whether the phone number was registered with Authy.,Apply mitigations per vendor instructions or discontinue use of the product if mitigations are unavailable.,2024-07-23,CVE-2024-39891,https://nvd.nist.gov/vuln/detail/CVE-2024-39891
Internet Explorer,Multiple,Microsoft,Critical,"Microsoft Internet Explorer contains a use-after-free vulnerability that allows a remote attacker to execute arbitrary code via a crafted web site that triggers access to an object that (1) was not properly allocated or (2) is deleted, as demonstrated by a CDwnBindInfo object.",The impacted product is end-of-life and should be disconnected if still in use.,2024-07-23,CVE-2012-4792,https://nvd.nist.gov/vuln/detail/CVE-2012-4792
vCenter Server,Multiple,VMware,Critical,"VMware vCenter Server contains an incorrect default file permissions vulnerability that allows a remote, privileged attacker to gain access to sensitive information.",Apply mitigations per vendor instructions or discontinue use of the product if mitigations are unavailable.,2024-07-17,CVE-2022-22948,https://nvd.nist.gov/vuln/detail/CVE-2022-22948
Serv-U,Multiple,SolarWinds,Critical,SolarWinds Serv-U contains a path traversal vulnerability that allows an attacker access to read sensitive files on the host machine.,Apply mitigations per vendor instructions or discontinue use of the product if mitigations are unavailable.,2024-07-17,CVE-2024-28995,https://nvd.nist.gov/vuln/detail/CVE-2024-28995
Commerce and Magento Open Source,Multiple,Adobe,Critical,Adobe Commerce and Magento Open Source contain an improper restriction of XML external entity reference (XXE) vulnerability that allows for remote code execution.,Apply mitigations per vendor instructions or discontinue use of the product if mitigations are unavailable.,2024-07-17,CVE-2024-34102,https://nvd.nist.gov/vuln/detail/CVE-2024-34102
GeoServer,Multiple,OSGeo,Critical,OSGeo GeoServer GeoTools contains an improper neutralization of directives in dynamically evaluated code vulnerability due to unsafely evaluating property names as XPath expressions. This allows unauthenticated attackers to conduct remote code execution via specially crafted input.,Apply mitigations per vendor instructions or discontinue use of the product if mitigations are unavailable.,2024-07-15,CVE-2024-36401,https://nvd.nist.gov/vuln/detail/CVE-2024-36401
HTTP File Server,Multiple,Rejetto,Critical,"Rejetto HTTP File Server contains an improper neutralization of special elements used in a template engine vulnerability. This allows a remote, unauthenticated attacker to execute commands on the affected system by sending a specially crafted HTTP request.",Apply mitigations per vendor instructions or discontinue use of the product if mitigations are unavailable.,2024-07-09,CVE-2024-23692,https://nvd.nist.gov/vuln/detail/CVE-2024-23692
Windows ,Multiple,Microsoft,Critical,Microsoft Windows Hyper-V contains a privilege escalation vulnerability that allows a local attacker with user permissions to gain SYSTEM privileges.,Apply mitigations per vendor instructions or discontinue use of the product if mitigations are unavailable.,2024-07-09,CVE-2024-38080,https://nvd.nist.gov/vuln/detail/CVE-2024-38080
Windows,Multiple,Microsoft,Critical,"Microsoft Windows MSHTML Platform contains a spoofing vulnerability that has a high impact to confidentiality, integrity, and availability.",Apply mitigations per vendor instructions or discontinue use of the product if mitigations are unavailable.,2024-07-09,CVE-2024-38112,https://nvd.nist.gov/vuln/detail/CVE-2024-38112
NX-OS,Multiple,Cisco,Critical,"Cisco NX-OS contains a command injection vulnerability in the command line interface (CLI) that could allow an authenticated, local attacker to execute commands as root on the underlying operating system of an affected device.",Apply mitigations per vendor instructions or discontinue use of the product if mitigations are unavailable.,2024-07-02,CVE-2024-20399,https://nvd.nist.gov/vuln/detail/CVE-2024-20399
Webmail,Multiple,Roundcube,Critical,Roundcube Webmail contains a cross-site scripting (XSS) vulnerability that allows a remote attacker to manipulate data via a malicious XML attachment.,Apply mitigations per vendor instructions or discontinue use of the product if mitigations are unavailable.,2024-06-26,CVE-2020-13965,https://nvd.nist.gov/vuln/detail/CVE-2020-13965
Kernel,Multiple,Linux,Critical,"Linux Kernel contains a use-after-free vulnerability in the nft_object, allowing local attackers to escalate privileges. ",Apply updates per vendor instructions or discontinue use of the product if updates are unavailable.,2024-06-26,CVE-2022-2586,https://nvd.nist.gov/vuln/detail/CVE-2022-2586
JAI-EXT,Multiple,OSGeo,Critical,"OSGeo GeoServer JAI-EXT contains a code injection vulnerability that, when programs use jt-jiffle and allow Jiffle script to be provided via network request, could allow remote code execution.",Apply mitigations per vendor instructions or discontinue use of the product if mitigations are unavailable.,2024-06-26,CVE-2022-24816,https://nvd.nist.gov/vuln/detail/CVE-2022-24816
Telerik Report Server,Multiple,Progress,Critical,Progress Telerik Report Server contains an authorization bypass by spoofing vulnerability that allows an attacker to obtain unauthorized access.,Apply mitigations per vendor instructions or discontinue use of the product if mitigations are unavailable.,2024-06-13,CVE-2024-4358,https://nvd.nist.gov/vuln/detail/CVE-2024-4358
Windows,Multiple,Microsoft,Critical,Microsoft Windows Error Reporting Service contains an improper privilege management vulnerability that allows a local attacker with user permissions to gain SYSTEM privileges.,Apply updates per vendor instructions or discontinue use of the product if updates are unavailable.,2024-06-13,CVE-2024-26169,https://nvd.nist.gov/vuln/detail/CVE-2024-26169
Pixel,Multiple,Android,Critical,Android Pixel contains an unspecified vulnerability in the firmware that allows for privilege escalation.,Apply mitigations per vendor instructions or discontinue use of the product if mitigations are unavailable.,2024-06-13,CVE-2024-32896,https://nvd.nist.gov/vuln/detail/CVE-2024-32896
PHP,Multiple,PHP Group,Critical,"PHP, specifically Windows-based PHP used in CGI mode, contains an OS command injection vulnerability that allows for arbitrary code execution. This vulnerability is a patch bypass for CVE-2012-1823.",Apply mitigations per vendor instructions or discontinue use of the product if mitigations are unavailable.,2024-06-12,CVE-2024-4577,https://nvd.nist.gov/vuln/detail/CVE-2024-4577
Mali GPU Kernel Driver,Multiple,Arm,Critical,"Arm Bifrost and Valhall GPU kernel drivers contain a use-after-free vulnerability that allows a local, non-privileged user to make improper GPU memory processing operations to gain access to already freed memory.",Apply mitigations per vendor instructions or discontinue use of the product if mitigations are unavailable.,2024-06-12,CVE-2024-4610,https://nvd.nist.gov/vuln/detail/CVE-2024-4610
WebLogic Server,Multiple,Oracle,Critical,"Oracle WebLogic Server, a product within the Fusion Middleware suite, contains an OS command injection vulnerability that allows an attacker to execute arbitrary code via a specially crafted HTTP request that includes a malicious XML document.",Apply mitigations per vendor instructions or discontinue use of the product if mitigations are unavailable.,2024-06-03,CVE-2017-3506,https://nvd.nist.gov/vuln/detail/CVE-2017-3506
Kernel,Multiple,Linux,Critical,Linux kernel contains a use-after-free vulnerability in the netfilter: nf_tables component that allows an attacker to achieve local privilege escalation.,Apply mitigations per vendor instructions or discontinue use of the product if mitigations are unavailable.,2024-05-30,CVE-2024-1086,https://nvd.nist.gov/vuln/detail/CVE-2024-1086
Quantum Security Gateways,Multiple,Check Point,Critical,"Check Point Quantum Security Gateways contain an unspecified information disclosure vulnerability. The vulnerability potentially allows an attacker to access information on Gateways connected to the internet, with IPSec VPN, Remote Access VPN or Mobile Access enabled. This issue affects several product lines from Check Point, including CloudGuard Network, Quantum Scalable Chassis, Quantum Security Gateways, and Quantum Spark Appliances.",Apply mitigations per vendor instructions or discontinue use of the product if mitigations are unavailable.,2024-05-30,CVE-2024-24919,https://nvd.nist.gov/vuln/detail/CVE-2024-24919
Viewer ,Multiple,Justice AV Solutions,Critical,"Justice AV Solutions (JAVS) Viewer installer contains a malicious version of ffmpeg.exe, named fffmpeg.exe (SHA256: 421a4ad2615941b177b6ec4ab5e239c14e62af2ab07c6df1741e2a62223223c4). When run, this creates a backdoor connection to a malicious C2 server.",Apply mitigations per vendor instructions or discontinue use of the product if mitigations are unavailable.,2024-05-29,CVE-2024-4978,https://nvd.nist.gov/vuln/detail/CVE-2024-4978
Chromium V8,Multiple,Google,Critical,"Google Chromium V8 contains a type confusion vulnerability that allows a remote attacker to execute code via a crafted HTML page. This vulnerability could affect multiple web browsers that utilize Chromium, including, but not limited to, Google Chrome, Microsoft Edge, and Opera.",Apply mitigations per vendor instructions or discontinue use of the product if mitigations are unavailable.,2024-05-28,CVE-2024-5274,https://nvd.nist.gov/vuln/detail/CVE-2024-5274
Flink,Multiple,Apache,Critical,Apache Flink contains an improper access control vulnerability that allows an attacker to read any file on the local filesystem of the JobManager through its REST interface.,Apply mitigations per vendor instructions or discontinue use of the product if mitigations are unavailable.,2024-05-23,CVE-2020-17519,https://nvd.nist.gov/vuln/detail/CVE-2020-17519
Chromium V8,Multiple,Google,Critical,Google Chromium V8 contains a type confusion vulnerability that allows a remote attacker to execute code via a crafted HTML page.,Apply mitigations per vendor instructions or discontinue use of the product if mitigations are unavailable.,2024-05-20,CVE-2024-4947,https://nvd.nist.gov/vuln/detail/CVE-2024-4947
Mirth Connect,Multiple,NextGen Healthcare,Critical,NextGen Healthcare Mirth Connect contains a deserialization of untrusted data vulnerability that allows for unauthenticated remote code execution via a specially crafted request.,Apply mitigations per vendor instructions or discontinue use of the product if mitigations are unavailable.,2024-05-20,CVE-2023-43208,https://nvd.nist.gov/vuln/detail/CVE-2023-43208
Chromium V8,Multiple,Google,Critical,"Google Chromium V8 Engine contains an unspecified out-of-bounds memory write vulnerability via a crafted HTML page. This vulnerability could affect multiple web browsers that utilize Chromium, including, but not limited to, Google Chrome, Microsoft Edge, and Opera. ",Apply mitigations per vendor instructions or discontinue use of the product if mitigations are unavailable.,2024-05-16,CVE-2024-4761,https://nvd.nist.gov/vuln/detail/CVE-2024-4761
DIR-605 Router,Multiple,D-Link,Critical,D-Link DIR-605 routers contain an information disclosure vulnerability that allows attackers to obtain a username and password by forging a post request to the /getcfg.php page. ,This vulnerability affects legacy D-Link products. All associated hardware revisions have reached their end-of-life (EOL) or end-of-service (EOS) life cycle and should be retired and replaced per vendor instructions.,2024-05-16,CVE-2021-40655,https://nvd.nist.gov/vuln/detail/CVE-2021-40655
DIR-600 Router,Multiple,D-Link,Critical,D-Link DIR-600 routers contain a cross-site request forgery (CSRF) vulnerability that allows an attacker to change router configurations by hijacking an existing administrator session.,This vulnerability affects legacy D-Link products. All associated hardware revisions have reached their end-of-life (EOL) or end-of-service (EOS) life cycle and should be retired and replaced per vendor instructions.,2024-05-16,CVE-2014-100005,https://nvd.nist.gov/vuln/detail/CVE-2014-100005
Windows,Multiple,Microsoft,Critical,Microsoft Windows MSHTML Platform contains an unspecified vulnerability that allows for a security feature bypass.,Apply mitigations per vendor instructions or discontinue use of the product if mitigations are unavailable.,2024-05-14,CVE-2024-30040,https://nvd.nist.gov/vuln/detail/CVE-2024-30040
DWM Core Library,Multiple,Microsoft,Critical,Microsoft DWM Core Library contains a privilege escalation vulnerability that allows an attacker to gain SYSTEM privileges.,Apply mitigations per vendor instructions or discontinue use of the product if mitigations are unavailable.,2024-05-14,CVE-2024-30051,https://nvd.nist.gov/vuln/detail/CVE-2024-30051
Chromium,Multiple,Google,Critical,"Google Chromium Visuals contains a use-after-free vulnerability that allows a remote attacker to exploit heap corruption via a crafted HTML page. This vulnerability could affect multiple web browsers that utilize Chromium, including, but not limited to, Google Chrome, Microsoft Edge, and Opera.",Apply mitigations per vendor instructions or discontinue use of the product if mitigations are unavailable.,2024-05-13,CVE-2024-4671,https://nvd.nist.gov/vuln/detail/CVE-2024-4671
GitLab CE/EE,Multiple,GitLab,Critical,GitLab Community and Enterprise Editions contain an improper access control vulnerability. This allows an attacker to trigger password reset emails to be sent to an unverified email address to ultimately facilitate an account takeover.,Apply mitigations per vendor instructions or discontinue use of the product if mitigations are unavailable.,2024-05-01,CVE-2023-7028,https://nvd.nist.gov/vuln/detail/CVE-2023-7028
SmartScreen Prompt,Multiple,Microsoft,Critical,Microsoft SmartScreen Prompt contains a security feature bypass vulnerability that allows an attacker to bypass the Mark of the Web (MotW) feature. This vulnerability can be chained with CVE-2023-38831 and CVE-2024-21412 to execute a malicious file.,Apply mitigations per vendor instructions or discontinue use of the product if mitigations are unavailable.,2024-04-30,CVE-2024-29988,https://nvd.nist.gov/vuln/detail/CVE-2024-29988
CrushFTP,Multiple,CrushFTP,Critical,CrushFTP contains an unspecified sandbox escape vulnerability that allows a remote attacker to escape the CrushFTP virtual file system (VFS).,Apply mitigations per vendor instructions or discontinue use of the product if mitigations are unavailable.,2024-04-24,CVE-2024-4040,https://nvd.nist.gov/vuln/detail/CVE-2024-4040
Adaptive Security Appliance (ASA) and Firepower Threat Defense (FTD),Multiple,Cisco,Critical,Cisco Adaptive Security Appliance (ASA) and Firepower Threat Defense (FTD) contain a privilege escalation vulnerability that can allow local privilege escalation from Administrator to root.,Apply mitigations per vendor instructions or discontinue use of the product if mitigations are unavailable.,2024-04-24,CVE-2024-20359,https://nvd.nist.gov/vuln/detail/CVE-2024-20359
Adaptive Security Appliance (ASA) and Firepower Threat Defense (FTD),Multiple,Cisco,Critical,Cisco Adaptive Security Appliance (ASA) and Firepower Threat Defense (FTD) contain an infinite loop vulnerability that can lead to remote denial of service condition.,Apply mitigations per vendor instructions or discontinue use of the product if mitigations are unavailable.,2024-04-24,CVE-2024-20353,https://nvd.nist.gov/vuln/detail/CVE-2024-20353
