product_name,product_version,oem_name,severity_level,vulnerability_description,mitigation_strategy,published_date,cve_id,url
ChakraCore scripting engine,Multiple,ChakraCore,Critical,The ChakraCore scripting engine contains a type confusion vulnerability which can allow for remote code execution.,Apply updates per vendor instructions.,2022-03-03,CVE-2018-8298,https://nvd.nist.gov/vuln/detail/CVE-2018-8298
IOS Software,Multiple,Cisco,Critical,"A vulnerability in the Login Enhancements (Login Block) feature of Cisco IOS Software could allow an unauthenticated, remote attacker to trigger a reload of an affected system, resulting in a denial of service (DoS) condition.",Apply updates per vendor instructions.,2022-03-03,CVE-2018-0180,https://nvd.nist.gov/vuln/detail/CVE-2018-0180
IOS Software,Multiple,Cisco,Critical,"A vulnerability in the Login Enhancements (Login Block) feature of Cisco IOS Software could allow an unauthenticated, remote attacker to trigger a reload of an affected system, resulting in a denial of service (DoS) condition.",Apply updates per vendor instructions.,2022-03-03,CVE-2018-0179,https://nvd.nist.gov/vuln/detail/CVE-2018-0179
"IOS, XR, and XE Software",Multiple,Cisco,Critical,"Format string vulnerability in the Link Layer Discovery Protocol (LLDP) subsystem of Cisco IOS Software, Cisco IOS XE Software, and Cisco IOS XR Software could allow an unauthenticated, adjacent attacker to cause a denial of service (DoS) condition or execute arbitrary code with elevated privileges on an affected device.",Apply updates per vendor instructions.,2022-03-03,CVE-2018-0175,https://nvd.nist.gov/vuln/detail/CVE-2018-0175
IOS XE Software,Multiple,Cisco,Critical,A vulnerability in the DHCP option 82 encapsulation functionality of Cisco IOS Software and Cisco IOS XE Software could allow for denial-of-service (DoS).,Apply updates per vendor instructions.,2022-03-03,CVE-2018-0174,https://nvd.nist.gov/vuln/detail/CVE-2018-0174
IOS and IOS XE Software,Multiple,Cisco,Critical,A vulnerability in the Cisco IOS Software and Cisco IOS XE Software function that restores encapsulated option 82 information in DHCP Version 4 (DHCPv4) packets can allow for denial-of-service (DoS).,Apply updates per vendor instructions.,2022-03-03,CVE-2018-0173,https://nvd.nist.gov/vuln/detail/CVE-2018-0173
IOS and IOS XE Software,Multiple,Cisco,Critical,A vulnerability in the DHCP option 82 encapsulation functionality of Cisco IOS Software and Cisco IOS XE Software could allow for denial-of-service (DoS).,Apply updates per vendor instructions.,2022-03-03,CVE-2018-0172,https://nvd.nist.gov/vuln/detail/CVE-2018-0172
"IOS, XR, and XE Software",Multiple,Cisco,Critical,"There is a buffer overflow vulnerability in the Link Layer Discovery Protocol (LLDP) subsystem of Cisco IOS Software, Cisco IOS XE Software, and Cisco IOS XR Software which could allow an unauthenticated, adjacent attacker to cause a denial of service (DoS) condition or execute arbitrary code.",Apply updates per vendor instructions.,2022-03-03,CVE-2018-0167,https://nvd.nist.gov/vuln/detail/CVE-2018-0167
IOS Software,Multiple,Cisco,Critical,"A vulnerability in the Simple Network Management Protocol (SNMP) subsystem of Cisco IOS Software running on certain models of Cisco Catalyst Switches could allow an authenticated, remote attacker to cause a denial-of-service (DoS) condition.",Apply updates per vendor instructions.,2022-03-03,CVE-2018-0161,https://nvd.nist.gov/vuln/detail/CVE-2018-0161
IOS Software and Cisco IOS XE Software,Multiple,Cisco,Critical,"A vulnerability in the implementation of Internet Key Exchange Version 1 (IKEv1) functionality in Cisco IOS Software and Cisco IOS XE Software could allow an unauthenticated, remote attacker to cause an affected device to reload, resulting in a denial-of-service (DoS) condition.",Apply updates per vendor instructions.,2022-03-03,CVE-2018-0159,https://nvd.nist.gov/vuln/detail/CVE-2018-0159
IOS Software and Cisco IOS XE Software,Multiple,Cisco,Critical,"A vulnerability in the implementation of Internet Key Exchange Version 1 (IKEv1) functionality in Cisco IOS Software and Cisco IOS XE Software could allow an unauthenticated, remote attacker to cause an affected device to reload, resulting in a denial-of-service (DoS) condition.",Apply updates per vendor instructions.,2022-03-03,CVE-2018-0158,https://nvd.nist.gov/vuln/detail/CVE-2018-0158
IOS Software and Cisco IOS XE Software,Multiple,Cisco,Critical,"A vulnerability in the Smart Install feature of Cisco IOS Software and Cisco IOS XE Software could allow an unauthenticated, remote attacker to trigger a reload of an affected device, resulting in a denial-of-service (DoS) condition.",Apply updates per vendor instructions.,2022-03-03,CVE-2018-0156,https://nvd.nist.gov/vuln/detail/CVE-2018-0156
Catalyst 4500 Series Switches and Cisco Catalyst 4500-X Series Switches,Multiple,Cisco,Critical,"A vulnerability in the Bidirectional Forwarding Detection (BFD) offload implementation of Cisco Catalyst 4500 Series Switches and Cisco Catalyst 4500-X Series Switches could allow an unauthenticated, remote attacker to cause a crash of the iosd process, causing a denial-of-service (DoS) condition.",Apply updates per vendor instructions.,2022-03-03,CVE-2018-0155,https://nvd.nist.gov/vuln/detail/CVE-2018-0155
IOS Software,Multiple,Cisco,Critical,"A vulnerability in the crypto engine of the Cisco Integrated Services Module for VPN (ISM-VPN) running Cisco IOS Software could allow an unauthenticated, remote attacker to cause a denial-of-service (DoS) condition.",Apply updates per vendor instructions.,2022-03-03,CVE-2018-0154,https://nvd.nist.gov/vuln/detail/CVE-2018-0154
IOS and IOS XE Software,Multiple,Cisco,Critical,"A vulnerability in the quality of service (QoS) subsystem of Cisco IOS Software and Cisco IOS XE Software could allow an unauthenticated, remote attacker to cause a denial of service (DoS) condition or execute arbitrary code with elevated privileges.",Apply updates per vendor instructions.,2022-03-03,CVE-2018-0151,https://nvd.nist.gov/vuln/detail/CVE-2018-0151
Malware Protection Engine,Multiple,Microsoft,Critical,"The Microsoft Malware Protection Engine running on Microsoft Forefront and Microsoft Defender on Microsoft Windows Server 2008 SP2 and R2 SP1, Windows 7 SP1, Windows 8.1, Windows Server 2012 Gold and R2, Windows RT 8.1, Windows 10 Gold, 1511, 1607, and 1703, and Windows Server 2016, Microsoft Exchange Server 2013 and 2016, does not properly scan a specially crafted file leading to memory corruption. aka ""Microsoft Malware Protection Engine Remote Code Execution Vulnerability"".",Apply updates per vendor instructions.,2022-03-03,CVE-2017-8540,https://nvd.nist.gov/vuln/detail/CVE-2017-8540
IOS software,Multiple,Cisco,Critical,"The Simple Network Management Protocol (SNMP) subsystem of Cisco IOS 1 contains a vulnerability that could allow an authenticated, remote attacker to remotely execute code on an affected system or cause an affected system to reload. An attacker could exploit these vulnerabilities by sending a crafted SNMP packet to an affected system via IPv4 or IPv6.",Apply updates per vendor instructions.,2022-03-03,CVE-2017-6744,https://nvd.nist.gov/vuln/detail/CVE-2017-6744
IOS and IOS XE Software,Multiple,Cisco,Critical,"The Simple Network Management Protocol (SNMP) subsystem of Cisco IOS and IOS XE contains a vulnerability that could allow an authenticated, remote attacker to remotely execute code.",Apply updates per vendor instructions.,2022-03-03,CVE-2017-6743,https://nvd.nist.gov/vuln/detail/CVE-2017-6743
IOS and IOS XE Software,Multiple,Cisco,Critical,"The Simple Network Management Protocol (SNMP) subsystem of Cisco IOS and IOS XE contains a vulnerability that could allow an authenticated, remote attacker to remotely execute code on an affected system or cause an affected system to reload.",Apply updates per vendor instructions.,2022-03-03,CVE-2017-6740,https://nvd.nist.gov/vuln/detail/CVE-2017-6740
IOS and IOS XE Software,Multiple,Cisco,Critical,"The Simple Network Management Protocol (SNMP) subsystem of Cisco IOS and IOS XE contains a vulnerability that could allow an authenticated, remote attacker to remotely execute code on an affected system or cause an affected system to reload.",Apply updates per vendor instructions.,2022-03-03,CVE-2017-6739,https://nvd.nist.gov/vuln/detail/CVE-2017-6739
IOS and IOS XE Software,Multiple,Cisco,Critical,"The Simple Network Management Protocol (SNMP) subsystem of Cisco IOS and IOS XE contains a vulnerability that could allow an authenticated, remote attacker to remotely execute code.",Apply updates per vendor instructions.,2022-03-03,CVE-2017-6738,https://nvd.nist.gov/vuln/detail/CVE-2017-6738
IOS and IOS XE Software,Multiple,Cisco,Critical,"The Simple Network Management Protocol (SNMP) subsystem of Cisco IOS and IOS XE contains a vulnerability that could allow an authenticated, remote attacker to remotely execute code.",Apply updates per vendor instructions.,2022-03-03,CVE-2017-6737,https://nvd.nist.gov/vuln/detail/CVE-2017-6737
IOS and IOS XE Software,Multiple,Cisco,Critical,"The Simple Network Management Protocol (SNMP) subsystem of Cisco IOS and IOS XE contains a vulnerability that could allow an authenticated, remote attacker to remotely execute code.",Apply updates per vendor instructions.,2022-03-03,CVE-2017-6736,https://nvd.nist.gov/vuln/detail/CVE-2017-6736
IOS and IOS XE Software,Multiple,Cisco,Critical,"A vulnerability in the Autonomic Networking feature of Cisco IOS Software and Cisco IOS XE Software could allow an unauthenticated, adjacent attacker to cause autonomic nodes of an affected system to reload, resulting in denial-of-service (DoS).",Apply updates per vendor instructions.,2022-03-03,CVE-2017-6663,https://nvd.nist.gov/vuln/detail/CVE-2017-6663
IOS and IOS XE Software,Multiple,Cisco,Critical,"A vulnerability in the UDP processing code of Cisco IOS and IOS XE could allow an unauthenticated, remote attacker to cause the input queue of an affected system to hold UDP packets, causing an interface queue wedge and denial of service.",Apply updates per vendor instructions.,2022-03-03,CVE-2017-6627,https://nvd.nist.gov/vuln/detail/CVE-2017-6627
IOS XE Software,Multiple,Cisco,Critical,"A vulnerability in the Border Gateway Protocol (BGP) over an Ethernet Virtual Private Network (EVPN) for Cisco IOS XE Software could allow an unauthenticated, remote attacker to cause the device to reload, resulting in a denial of service (DoS) condition, or potentially corrupt the BGP routing table, which could result in network instability.",Apply updates per vendor instructions.,2022-03-03,CVE-2017-12319,https://nvd.nist.gov/vuln/detail/CVE-2017-12319
IOS and IOS XE Software,Multiple,Cisco,Critical,"The Dynamic Host Configuration Protocol (DHCP) relay subsystem of Cisco IOS and Cisco IOS XE Software contains a vulnerability that could allow an unauthenticated, remote attacker to execute arbitrary code and gain full control of an affected system.",Apply updates per vendor instructions.,2022-03-03,CVE-2017-12240,https://nvd.nist.gov/vuln/detail/CVE-2017-12240
Catalyst 6800 Series Switches,Multiple,Cisco,Critical,"A vulnerability in the Virtual Private LAN Service (VPLS) code of Cisco IOS for Cisco Catalyst 6800 Series Switches could allow an unauthenticated, adjacent attacker to cause a denial of service.",Apply updates per vendor instructions.,2022-03-03,CVE-2017-12238,https://nvd.nist.gov/vuln/detail/CVE-2017-12238
IOS and IOS XE Software,Multiple,Cisco,Critical,"A vulnerability in the Internet Key Exchange Version 2 (IKEv2) module of Cisco IOS and Cisco IOS XE could allow an unauthenticated, remote attacker to cause high CPU utilization, traceback messages, or a reload of an affected device that leads to a denial of service.",Apply updates per vendor instructions.,2022-03-03,CVE-2017-12237,https://nvd.nist.gov/vuln/detail/CVE-2017-12237
IOS software,Multiple,Cisco,Critical,"A vulnerability in the implementation of the PROFINET Discovery and Configuration Protocol (PN-DCP) for Cisco IOS could allow an unauthenticated, remote attacker to cause an affected device to reload, resulting in a denial of service.",Apply updates per vendor instructions.,2022-03-03,CVE-2017-12235,https://nvd.nist.gov/vuln/detail/CVE-2017-12235
IOS software,Multiple,Cisco,Critical,"There is a vulnerability in the implementation of the Common Industrial Protocol (CIP) feature in Cisco IOS could allow an unauthenticated, remote attacker to cause an affected device to reload, resulting in a denial of service.",Apply updates per vendor instructions.,2022-03-03,CVE-2017-12234,https://nvd.nist.gov/vuln/detail/CVE-2017-12234
IOS software,Multiple,Cisco,Critical,"There is a vulnerability in the implementation of the Common Industrial Protocol (CIP) feature in Cisco IOS could allow an unauthenticated, remote attacker to cause an affected device to reload, resulting in a denial of service.",Apply updates per vendor instructions.,2022-03-03,CVE-2017-12233,https://nvd.nist.gov/vuln/detail/CVE-2017-12233
IOS software,Multiple,Cisco,Critical,"A vulnerability in the implementation of a protocol in Cisco Integrated Services Routers Generation 2 (ISR G2) Routers running Cisco IOS could allow an unauthenticated, adjacent attacker to cause an affected device to reload, resulting in a denial of service.",Apply updates per vendor instructions.,2022-03-03,CVE-2017-12232,https://nvd.nist.gov/vuln/detail/CVE-2017-12232
IOS software,Multiple,Cisco,Critical,"A vulnerability in the implementation of Network Address Translation (NAT) functionality in Cisco IOS could allow an unauthenticated, remote attacker to cause a denial of service.",Apply updates per vendor instructions.,2022-03-03,CVE-2017-12231,https://nvd.nist.gov/vuln/detail/CVE-2017-12231
Office,Multiple,Microsoft,Critical,A remote code execution vulnerability exists in Microsoft Office software when the software fails to properly handle objects in memory. An attacker who successfully exploited the vulnerability could run arbitrary code in the context of the current user.,Apply updates per vendor instructions.,2022-03-03,CVE-2017-11826,https://nvd.nist.gov/vuln/detail/CVE-2017-11826
Flash Player,Multiple,Adobe,Critical,Adobe Flash Player contains a type confusion vulnerability which can allow for remote code execution.,The impacted product is end-of-life and should be disconnected if still in use.,2022-03-03,CVE-2017-11292,https://nvd.nist.gov/vuln/detail/CVE-2017-11292
Office,Multiple,Microsoft,Critical,Microsoft Office contains a use-after-free vulnerability which can allow for remote code execution.,Apply updates per vendor instructions.,2022-03-03,CVE-2017-0261,https://nvd.nist.gov/vuln/detail/CVE-2017-0261
Graphics Device Interface (GDI),Multiple,Microsoft,Critical,"The Graphics Device Interface (GDI) in Microsoft Windows Vista SP2; Windows Server 2008 SP2 and R2 SP1; Windows 7 SP1; Windows 8.1; Windows Server 2012 Gold and R2; Windows RT 8.1; and Windows 10 Gold, 1511, and 1607 allows local users to gain privileges",Apply updates per vendor instructions.,2022-03-03,CVE-2017-0001,https://nvd.nist.gov/vuln/detail/CVE-2017-0001
SIMATIC CP,Multiple,Siemens,Critical,An improper privilege management vulnerability exists within the Siemens SIMATIC Communication Processor (CP) that allows a privileged attacker to remotely cause a denial of service.,Apply updates per vendor instructions.,2022-03-03,CVE-2016-8562,https://nvd.nist.gov/vuln/detail/CVE-2016-8562
Flash Player,Multiple,Adobe,Critical,Use-after-free vulnerability in Adobe Flash Player Windows and OS and Linux allows remote attackers to execute arbitrary code.,The impacted product is end-of-life and should be disconnected if still in use.,2022-03-03,CVE-2016-7855,https://nvd.nist.gov/vuln/detail/CVE-2016-7855
Excel,Multiple,Microsoft,Critical,A security feature bypass vulnerability exists when Microsoft Office improperly handles input. An attacker who successfully exploited the vulnerability could execute arbitrary commands.,Apply updates per vendor instructions.,2022-03-03,CVE-2016-7262,https://nvd.nist.gov/vuln/detail/CVE-2016-7262
Office,Multiple,Microsoft,Critical,Microsoft Office contains a memory corruption vulnerability which can allow for remote code execution.,Apply updates per vendor instructions.,2022-03-03,CVE-2016-7193,https://nvd.nist.gov/vuln/detail/CVE-2016-7193
Kernel,Multiple,Linux,Critical,Race condition in mm/gup.c in the Linux kernel allows local users to escalate privileges.,Apply updates per vendor instructions.,2022-03-03,CVE-2016-5195,https://nvd.nist.gov/vuln/detail/CVE-2016-5195
Flash Player,Multiple,Adobe,Critical,An access of resource using incompatible type vulnerability exists within Adobe Flash Player that allows an attacker to perform remote code execution.,The impacted product is end-of-life and should be disconnected if still in use.,2022-03-03,CVE-2016-4117,https://nvd.nist.gov/vuln/detail/CVE-2016-4117
Flash Player,Multiple,Adobe,Critical,Adobe Flash Player allows remote attackers to cause a denial of service or possibly execute arbitrary code.,The impacted product is end-of-life and should be disconnected if still in use.,2022-03-03,CVE-2016-1019,https://nvd.nist.gov/vuln/detail/CVE-2016-1019
Windows,Multiple,Microsoft,Critical,A privilege escalation vulnerability exists in Microsoft Windows if the Windows Secondary Logon Service fails to properly manage request handles in memory. An attacker who successfully exploited this vulnerability could run arbitrary code as an administrator.,Apply updates per vendor instructions.,2022-03-03,CVE-2016-0099,https://nvd.nist.gov/vuln/detail/CVE-2016-0099
Flash Player,Multiple,Adobe,Critical,Adobe Flash Player allows remote attackers to execute arbitrary code via a crafted SWF file.,The impacted product is end-of-life and should be disconnected if still in use.,2022-03-03,CVE-2015-7645,https://nvd.nist.gov/vuln/detail/CVE-2015-7645
Flash Player,Multiple,Adobe,Critical,A use-after-free vulnerability exists within the ActionScript 3 ByteArray class in Adobe Flash Player that allows an attacker to perform remote code execution.,The impacted product is end-of-life and should be disconnected if still in use.,2022-03-03,CVE-2015-5119,https://nvd.nist.gov/vuln/detail/CVE-2015-5119
Java SE,Multiple,Oracle,Critical,Unspecified vulnerability in Oracle Java SE allows remote attackers to affect integrity via Unknown vectors related to deployment.,Apply updates per vendor instructions.,2022-03-03,CVE-2015-4902,https://nvd.nist.gov/vuln/detail/CVE-2015-4902
Flash Player,Multiple,Adobe,Critical,A memory corruption vulnerability exists in Adobe Flash Player that allows an attacker to perform remote code execution.,The impacted product is end-of-life and should be disconnected if still in use.,2022-03-03,CVE-2015-3043,https://nvd.nist.gov/vuln/detail/CVE-2015-3043
Java SE,Multiple,Oracle,Critical,An unspecified vulnerability exists within Oracle Java Runtime Environment that allows an attacker to perform remote code execution.,Apply updates per vendor instructions.,2022-03-03,CVE-2015-2590,https://nvd.nist.gov/vuln/detail/CVE-2015-2590
Office,Multiple,Microsoft,Critical,Microsoft Office allows remote attackers to execute arbitrary code via a crafted EPS image.,Apply updates per vendor instructions.,2022-03-03,CVE-2015-2545,https://nvd.nist.gov/vuln/detail/CVE-2015-2545
PowerPoint,Multiple,Microsoft,Critical,Microsoft PowerPoint allows remote attackers to execute arbitrary code or cause a denial of service (memory corruption) via a crafted Office document.,Apply updates per vendor instructions.,2022-03-03,CVE-2015-2424,https://nvd.nist.gov/vuln/detail/CVE-2015-2424
ATM Font Driver,Multiple,Microsoft,Critical,ATMFD.DLL in the Adobe Type Manager Font Driver in Microsoft Windows Server allows local users to gain privileges via a crafted application.,Apply updates per vendor instructions.,2022-03-03,CVE-2015-2387,https://nvd.nist.gov/vuln/detail/CVE-2015-2387
Win32k,Multiple,Microsoft,Critical,An unspecified vulnerability exists in the Win32k.sys kernel-mode driver in Microsoft Windows Server that allows a local attacker to execute arbitrary code with elevated privileges.,Apply updates per vendor instructions.,2022-03-03,CVE-2015-1701,https://nvd.nist.gov/vuln/detail/CVE-2015-1701
Office,Multiple,Microsoft,Critical,Microsoft Office contains a memory corruption vulnerability that allows remote attackers to execute arbitrary code via a crafted document.,Apply updates per vendor instructions.,2022-03-03,CVE-2015-1642,https://nvd.nist.gov/vuln/detail/CVE-2015-1642
Windows,Multiple,Microsoft,Critical,A vulnerability exists in Windows Object Linking & Embedding (OLE) that could allow remote code execution if a user opens a file that contains a specially crafted OLE object.,Apply updates per vendor instructions.,2022-03-03,CVE-2014-4114,https://nvd.nist.gov/vuln/detail/CVE-2014-4114
Reader and Acrobat,Multiple,Adobe,Critical,Adobe Reader and Acrobat contain a use-after-free vulnerability which can allow for code execution.,Apply updates per vendor instructions.,2022-03-03,CVE-2014-0496,https://nvd.nist.gov/vuln/detail/CVE-2014-0496
Windows,Multiple,Microsoft,Critical,Microsoft Windows NDProxy.sys in the kernel contains an improper input validation vulnerability which can allow a local attacker to escalate privileges.,Apply updates per vendor instructions.,2022-03-03,CVE-2013-5065,https://nvd.nist.gov/vuln/detail/CVE-2013-5065
Internet Explorer,Multiple,Microsoft,Critical,A use-after-free vulnerability exists within CDisplayPointer in Microsoft Internet Explorer that allows an attacker to remotely execute arbitrary code.,Apply updates per vendor instructions.,2022-03-03,CVE-2013-3897,https://nvd.nist.gov/vuln/detail/CVE-2013-3897
Reader and Acrobat,Multiple,Adobe,Critical,Adobe Reader and Acrobat contain a memory corruption vulnerability which can allow attackers to execute arbitrary code or cause a denial of service.,Apply updates per vendor instructions.,2022-03-03,CVE-2013-3346,https://nvd.nist.gov/vuln/detail/CVE-2013-3346
Firefox,Multiple,Mozilla,Critical,"Mozilla Firefox does not properly initialize data structures for the nsDOMSVGZoomEvent::mPreviousScale and nsDOMSVGZoomEvent::mNewScale functions, which allows remote attackers to obtain sensitive information from process memory via a crafted web site.",Apply updates per vendor instructions.,2022-03-03,CVE-2013-1675,https://nvd.nist.gov/vuln/detail/CVE-2013-1675
Internet Explorer,Multiple,Microsoft,Critical,This vulnerability may corrupt memory in a way that could allow an attacker to execute arbitrary code in the context of the current user within Internet Explorer.,Apply updates per vendor instructions.,2022-03-03,CVE-2013-1347,https://nvd.nist.gov/vuln/detail/CVE-2013-1347
Reader,Multiple,Adobe,Critical,A buffer overflow vulnerability exists in Adobe Reader which allows an attacker to perform remote code execution.,Apply updates per vendor instructions.,2022-03-03,CVE-2013-0641,https://nvd.nist.gov/vuln/detail/CVE-2013-0641
Reader and Acrobat,Multiple,Adobe,Critical,An memory corruption vulnerability exists in the acroform.dll in Adobe Reader that allows an attacker to perform remote code execution.,Apply updates per vendor instructions.,2022-03-03,CVE-2013-0640,https://nvd.nist.gov/vuln/detail/CVE-2013-0640
ColdFusion,Multiple,Adobe,Critical,An authentication bypass vulnerability exists in Adobe ColdFusion which could result in an unauthorized user gaining administrative access.,Apply updates per vendor instructions.,2022-03-03,CVE-2013-0632,https://nvd.nist.gov/vuln/detail/CVE-2013-0632
Java SE,Multiple,Oracle,Critical,The Java Runtime Environment (JRE) component in Oracle Java SE allow for remote code execution.,Apply updates per vendor instructions.,2022-03-03,CVE-2012-4681,https://nvd.nist.gov/vuln/detail/CVE-2012-4681
Office,Multiple,Microsoft,Critical,The TabStrip ActiveX control in the Common Controls in MSCOMCTL.OCX in Microsoft Office allows remote attackers to execute arbitrary code via a crafted (1) document or (2) web page that triggers system-state corruption.,Apply updates per vendor instructions.,2022-03-03,CVE-2012-1856,https://nvd.nist.gov/vuln/detail/CVE-2012-1856
Java SE,Multiple,Oracle,Critical,"Unspecified vulnerability in the Java Runtime Environment (JRE) component in Oracle Java SE allows remote attackers to affect confidentiality, integrity, and availability via Unknown vectors related to Hotspot.",Apply updates per vendor instructions.,2022-03-03,CVE-2012-1723,https://nvd.nist.gov/vuln/detail/CVE-2012-1723
Flash Player,Multiple,Adobe,Critical,Unspecified vulnerability in Adobe Flash Player allows remote attackers to execute arbitrary code or cause a denial of service via crafted SWF content.,The impacted product is end-of-life and should be disconnected if still in use.,2022-03-03,CVE-2012-1535,https://nvd.nist.gov/vuln/detail/CVE-2012-1535
Java SE,Multiple,Oracle,Critical,An incorrect type vulnerability exists in the Concurrency component of Oracle's Java Runtime Environment allows an attacker to remotely execute arbitrary code.,Apply updates per vendor instructions.,2022-03-03,CVE-2012-0507,https://nvd.nist.gov/vuln/detail/CVE-2012-0507
Java SE JDK and JRE,Multiple,Oracle,Critical,An access control vulnerability exists in the Applet Rhino Script Engine component of Oracle's Java Runtime Environment allows an attacker to remotely execute arbitrary code.,Apply updates per vendor instructions.,2022-03-03,CVE-2011-3544,https://nvd.nist.gov/vuln/detail/CVE-2011-3544
